Question,answer,A,B,C,D,E,
关格呕吐的病机是(    )。,D,外感风寒，胃气上逆,瘀血内阻，胃气上逆,痰饮内停，胃气上逆,湿浊毒邪，上逆犯胃,,
患者有慢性肾小球肾炎病史20年，2月来出现小便量极少，恶心呕吐，厌食乏力，腰膝酸软，尿黄赤，苔黄腻而干，脉濡数，诊断为(    )。,B,脾气不升之癃闭,脾肾亏虚，湿热内蕴之关格,肾阳衰惫之癃闭,脾肾阳虚，寒浊上犯之关格,,
走哺呕吐的病机是(    )。,A,大便不通，浊气上冲,外邪干胃，胃气上逆,瘀血内停，胃气上逆,痰饮内停，胃气上逆,,
患者有水肿病史5年，1月来小便量极少，呕吐清水，伴面色晦暗，畏寒怕冷，舌淡胖，脉沉细，证属哪一型关格?,D,脾肾亏虚，湿热内蕴,肝肾阴虚，肝风内动,心肾两虚，邪陷心包,脾肾阳虚，寒浊上犯,,
患者小便不通，呕吐清水，面色晦滞，畏寒怕冷，便溏，苔白滑，脉沉细，选方为(    )。,D,苏合香丸,生脉散,黄连温胆汤,温脾汤合吴茱萸汤,,
患者小便极少，恶心呕吐，心悸胸闷，痰涎壅盛，神昏躁狂，苔黄腻，脉滑数，最佳选方为(    )。,B,涤痰汤合苏合香丸,涤痰汤合紫雪丹,参附汤合苏合香丸,六味地黄丸合羚羊钩藤汤,,
关格病机中标实指的是(    )。,A,湿浊毒邪,痰浊之邪,瘀血浊邪,虫积之邪,,
患者小便不通，呕吐，神昏谵语，伴面白唇暗，四肢不温，痰涎壅盛，苔白腻，脉沉缓，最佳选方为(    )。,B,六味地黄丸合羚羊钩藤汤,涤痰汤合苏合香丸,涤痰汤合紫雪丹,参附汤加减,,
治疗关格忌用酸涩之品，用无比山药丸时应去掉哪味药物?,D,五味子,肉苁蓉,巴戟天,赤石脂,,
患者小便极少，呕恶频作，伴头晕目眩，肌肤干燥，舌质红而干，脉弦细数，最佳选方为(    )。,D,一贯煎合八正散,黄连温胆汤合五皮饮,吴茱萸汤合温胆汤,六味地黄丸合羚羊钩藤汤,,
湿热下注，扰动精室之遗精，最佳选方是(    )。,B,八正散,程氏萆薢清饮,龙胆泻肝汤,知柏地黄丸,,
遗精的病位主要在(    )脏腑。,B,脾肾,心肾,心脾,心肝,,
患者少寐多梦，梦中遗精，伴心中烦热，口干，小便短赤，舌质红，脉细数，最佳选方是(    )。,D,知柏地黄丸合交泰丸,大补阴丸合交泰丸,金锁固精丸合水陆二仙丹,黄连清心饮合三才封髓丹,,
君相火旺型遗精的治疗方药中配伍少量肉桂的用意是(    )。,C,补肾阳  温脾土,温脾土  壮心阳,引火归元  心肾交泰,摄肾气  固精室,,
肾虚不藏，精关不固之遗精，治疗除补肾外，应辅以(    )。,B,定心安神,固涩止精,补益脾胃,升阳举陷,,
妙香散主治哪一型遗精?,D,君相火旺，心肾不交,湿热下注，扰动精室,肾虚滑脱，精关不固,劳伤心脾，气不摄精,,
湿热下注型遗精，治疗不宜(    )。,C,清利湿热,清心利湿,早投固涩,苦泄厥阴,,
遗精阴损及阳，肾阴阳俱虚，治当(    )。,A,阴中求阳,。补肾固涩       ,滋阴清热,温补肾阳,,
遗精初起多见(    )。,C,虚证,虚实夹杂证   ,实证,热证,,
关于溢精的论述，(    )是错误的。,A,属病理现象,每月遗精1至2次,属生理现象,无其他不适,,
阳痿这一病名始见于哪本书籍?,C,《素问》,《灵枢》,《景岳全书》,《明医杂著》,,
命门火衰型阳痿，治疗除温肾壮阳外，应配合(    )治法。,B,补益心脾,滋肾填精,益肾宁神,疏肝解郁,,
《素问》所谓：“肾欲坚，急食苦以坚之”符合(    )型阳痿的治则。,D,肝郁不舒,命门火衰,心脾受损,湿热下注,,
患者阴茎痿软，阴囊湿痒臊臭，小便黄赤，苔黄腻，脉濡数，最佳选方为(    )。,A,龙胆泻肝汤,萆藓分清饮,黄连解毒汤,八正散,,
患者阳痿不举，烦躁，胁肋胀闷，食少便溏，苔薄，脉弦，有情志所伤史，最佳选方为(    )。,A,逍遥散,疏肝散,小柴胡汤,四磨饮子,,
阳痿的治疗主要从(    )人手。,A,病因病机,临床表现,病程长短,患者年龄,,
阳痿的病机有五种，其中最多见的是(    )。,B,恐惧伤肾,命门火衰,湿热下注,心脾受损,,
“壮火食气”的病理因素是指(    )。,C,肝郁不舒,心脾受损,湿热下注,恐惧伤肾,,
阳痿肝肾阴伤，虚火旺动，治宜(    )。,D,滋补肝阴,滋补肾阴,滋补肝肾,滋阴降火,,
患者梦中阳举，举则遗精，盗汗，五心烦热，腰膝酸软，舌红，少苔，脉细数，证属哪一型阳痿?,B,肝郁不舒,肝肾阴伤，虚火旺动,命门火衰,气血两虚，宗筋失养,,
恐惧伤肾型阳痿治宜温肾宁神，还可配伍哪类药物?,D,补益心脾,行气解郁,滋补肝肾,益气升阳,,
患者阴痉痿软，阴囊湿痒臊臭，伴阴部坠胀疼痛，小便不畅，余沥不尽，治疗清热利湿，可配伍哪一类药物?,B,疏肝理气,活血化瘀,补益心脾,益肾宁神,,
患者因惊恐而致阳痿，伴心悸易惊，苔薄白，脉弦细，最佳选方为(    )。,C,归脾汤,逍遥散,大补元煎,右归丸,,
郁病的主要病因是（    ）。,D,外感六淫,饮食不节,房室失节,情志内伤,,
郁病初起基本病变为（     ）。,B,食滞,气郁,痰郁,血郁,,
各证型郁证所共有的症状为（     ）。,A, 气郁症状,湿郁症状,痰湿症状,血郁症状,,
郁证主要受累脏器是(    )。,B,心、肺、脾,心、肝、脾,肝、脾、肾,心、肝、肾,,
下列(    )病证属郁证范畴。,C,虚火喉痹,噎膈,梅核气,癫病,,
首先采用郁证这一病名的医籍是(    )。,B,《丹溪心法》,《医学正传》,《金匮要略》,《景岳全书》,,
证见：情绪不宁，心悸，健忘，失眠五心烦热，盗汗。证属(    )。,C,阴虚火旺之盗汗,肝阴亏虚之郁证,心阴亏虚之郁证,心血不足之盗汗,,
“梅核气”与“脏躁”最早记载于(    )。,C,《景岳全书》,《古今医案大全》,《金匮要略》,《临证指南医案》,,
临床表现为多思善疑，头晕神疲，心悸胆怯，失眠健忘，纳差，面色不华，舌淡苔白脉细，应辨证为(  )。,A,心脾两虚之郁病,脾血虚之虚劳,脾阳虚之虚劳,心血虚之虚劳,,
郁病在调护方面应注意的主要因素是(    )。,A,情志因素,气候因素,饮食因素,睡眠状况,,
滋水清肝饮治疗郁病的证型为(    )。,A,肝阴亏虚,气郁化火,痰气郁结,肝气郁结,,
心阴亏虚之郁病出现心烦失眠，多梦遗精等症状时，治疗应首选(    )。,A,天王补心丹合交泰丸,天王补心丹合滋水清肝饮,天王补心丹合六味地黄丸,天王补心丹合归脾汤,,
治疗血证的良方犀角地黄汤首载于(    )。,D,《医学正传》,《诸病源候论》,《景岳全书》,《备急千金要方》,,
咳血亦称(    )。,D,衄血,吐血,呕血,嗽血,,
便血色红，大便不畅，或有腹痛，为(    )。,C,脾胃虚寒,瘀血内结,肠道湿热,气虚不摄,,
黄土汤治疗便血，其治法体现了(    )。,A,健脾温中，养血止血。,理气和中，养血止血。,健脾养心，益气摄血。,清化湿热，凉血止血。,,
肝火上炎之鼻衄首选(    )。,A,龙胆泻肝汤,丹栀消遥散,清胃散,清肝饮,,
玉女煎治疗鼻衄的证型为(    )。,B,热邪犯肺,胃热炽盛,肝火上炎,气血亏虚,,
鼻燥衄血，口干咽燥，身热咳嗽少痰，舌质红，苔薄，脉数，证属(    )。,C,肝火克肺,阴虚火旺,热邪犯肺,肺气亏虚,,
下面(    )不是吐血的特征。,B,血随呕吐而出,血呈泡沫状,可混有食物,多伴黑便,,
胃热壅盛之吐血，当选用(    )。,D,清胃散,泻心汤合清胃散,玉女煎,泻心汤合十灰散,,
吐血且出血量多，而见面色苍白，四肢厥冷，汗出脉微，应选用(    )。,A,独参汤,归脾汤,四逆汤,理中汤,,
小便赤黄灼热，尿血鲜红，心烦口渴，面赤口疮，夜寐不安，舌红，脉数，首选(    )。,C,归脾汤,泻心汤,小蓟饮子,六一散,,
尿血日久，血色淡红，头晕耳鸣，精神困惫，腰膝酸软，应当(    )。,B,补脾摄血,补益肾气，固摄止血,滋阴降火,益气滋阴，固摄止血,,
《先醒斋医学广笔记》提出的治吐血要法中不包括(    )。,A,凉血,行血,补肝,降气,,
阴虚火旺型紫斑当用(    )。,C,十灰散,知柏地黄丸,茜根散,归脾汤,,
便血色红，伴食少，体倦，面色萎黄，心悸，少寐，舌质淡，脉细，治法为(    )。,D,养血止血,凉血止血,固摄止血,益气摄血,,
患者汗出恶风，稍劳汗出尤甚，易于感冒，体倦乏力，脉细弱，苔薄白，宜用(    )。,C,桂枝汤,补中益气汤,玉屏风散,四君子汤，,,
肺卫不固型自汗治法是(    )。,D,补气升阳,祛风散邪,调和营卫,益气固表,,
汗出恶风，周身酸楚，时寒时热，半身汗出，苔白，脉缓，当用(    )。,B,小柴胡汤,桂枝汤,玉屏风散,归脾汤,,
营卫不和自汗，兼见：倦怠乏力，少气懒言等气虚症状者可用(    )。,D,大补黄芪汤,小建中汤,补中益气汤,黄芪建中汤,,
阴虚火旺与心血不足汗出较多时均可加用(    )。,D,黄芪、防风,黄芩、黄柏,生地、当归,牡枥、浮小麦,,
“盗汗”首见于哪一部医籍?,A,《金匮要略》,《笔花医镜》,《景岳全书》,《临证指南医案》,,
邪热郁蒸汗出，湿邪偏重者可用(    )。,C,龙胆泻肝汤,当归六黄汤,四妙丸,五苓散,,
《三因极—病证方论》又将盗汗称(    )。,D,脱汗,梦汗,夜汗,寝汗,,
自汗，五心烦热，兼午后潮热，面色潮红，口渴，治法为(    )。,D,调和营卫,清肝泄热,养阴止汗,滋阴降火,,
《内经》中认为消渴的主要病机为(    )。,A,内热,阴虚,肝火,阳虚,,
消渴之名首见于(    )。,B,《难经》,《素问》,《金匮要略》,《诸病源候论》,,
以多食为主症之消渴，治疗时首选(    )。,A,玉女煎,消渴方,清胃散,白虎汤,,
症见：烦渴多饮，口干舌燥，尿频量多，舌边尖红，苔黄，脉洪数。应选用(    )。,B,玉女煎,消渴方,六味地黄丸,金匮肾气丸,,
下消的主症是(    )。,B,多饮,多尿,多食,消瘦,,
一患者8年前患消渴，现症口渴引饮，能食便溏或饮食减少精神不振，四肢乏力，舌淡，脉细弱，治疗时首选(    )。,B,健脾丸,七味白术散,消渴方,金匮肾气丸,,
阴阳两虚之消渴的治法为(    )。,D,益肾壮阳，补肾固摄,滋阴补肾，润燥止渴,益肾泻火，补肾固摄,温阳滋阴，补肾固摄,,
消渴与瘿病共有的症状为(    )。,C,情绪易激动,多饮、多尿、尿甜,多食，易饥,眼球突出,,
消渴日久并发疮毒痈疽者，治宜(    )。,D,清热养阴，活血化瘀,活血化瘀，消散痈肿,清热解毒，益气养阴,清热解毒，消散痈肿,,
最早提出“内伤发热”这一病名的医籍是(    )。,C,《内经》,《景岳全书》,《症因脉治》,《症治汇补》,,
夜间发热，不欲近衣，少寐多梦，盗汗口干咽燥，为(    )。,A,阴虚发热,阴虚火旺盗汗,血虚发热,心血不足盗汗,,
最早提出甘温除热法的著作为(    )。,B,《内经》,《金匮要略》,《景岳全书》,《内外伤辨惑论》,,
低热，每因生气后加重，精神抑郁，胁肋胀满，，燥烦易怒，口苦纳少，舌红苔黄，脉弦数，证属(    )。,D,气虚发热,血瘀发热,湿郁发热,气郁发热,,
甘温除热的代表方剂为(    )。,A,补中益气汤,四君子汤,四逆汤,归脾汤,,
血虚发热的治法为(    )。,C,养血清热,养血滋阴,益气养血,养血活血,,
发热，热势或高或低，劳累后加剧，倦怠乏力，气短懒言，自汗，食少便溏，舌质淡苔白，脉细弱，应当(    )。,B,补血养心，益气止汗,益气健脾，甘温除热,温补阳气，引火归元,疏肝理气，解郁泻热,,
治疗阴虚发热首选(    )。,A,清骨散,六味地黄丸,归脾汤,补中益气汤,,
发热而欲近衣，形寒怯冷，四肢不温，少气懒言，腰膝酸软，纳少便溏，面色晃白，舌质淡，苔白润，脉沉细无力，治方首选(    )。,D,六味地黄丸,归脾汤,补中益气丸,金匮肾气丸,,
气郁发热日久，热伤阴津，则转化为(    )。,B,阴虚发热,气郁阴虚发热,气阴两虚发热,气血两虚发热,,
“精气夺则虚”出自(    )。,B,《素问·调经论》,《素问·通评虚实论》,《难经·十四难》,《诸病源候论·虚劳病诸候》,,
首先提出了虚劳病名的医籍是(    )。,C,《素问》,《理虚元鉴》,《金匮要略》,《诸病源候论》,,
脾气虚之虚劳，治疗时应选用(    )。,B,归脾汤,加味四君子汤,益胃汤,补中益气汤,,
第一部论述虚劳的专书是(    )。,D,《不居集》,《医宗必读》,《虚劳论》,《理虚元鉴》,,
虚劳证见：头痛眩晕，耳鸣，目干畏光视物不明，肢麻肉晌，证属(    )。,C,肝血虚,肝气虚,肝阴虚,肝阳虚,,
虚劳证见：干咳，失音，咯血伴潮热盗汗，舌红少津，脉细数，治当(    )。,C,补益肺气,养血润肺,养阴润肺,补肺止咳,,
虚劳的基本治则是(    )。,C,治本,理气,补益,泻实,,
虚劳见悸，自汗，神倦，嗜卧，心胸憋闷，形寒肢冷，面色苍白，舌质淡，脉沉迟，当选用(    )。,B,右归丸,保元汤,附子理中丸,金匮肾气丸,,
治疗血虚之虚劳不宜单用血药，应适当配伍(    )。,C,补阳,补阴,补气,活血,,
虚劳见口干唇燥，不思饮食，大便燥结干呕，面色潮红，舌干苔少，治当(    )。,D,滋阴养心,补肝养血,益气补血,养阴和胃,,
心血虚之虚劳，治疗应当选用(    )。,A,养心汤,七福饮,保元汤       Ｄ天王补心丹,,,
肝气虚之虚劳，在治疗肝脏的基础上，结合(    )论治。,B,心气亏虚,脾气亏虚,肺气亏虚,肾气亏虚,,
积聚之名首见于(    )。,C,《景岳全书》,《医宗必读·积聚》,《灵枢·五变》,《素问》,,
对积与聚作了明确区别的医籍是(    )。,B,《内经》,《难经》,《金匮要略》,《证治准绳》,,
聚证的临床特证不包括(    )。,D,腹中气聚,攻窜胀痛,时作时止,可扪及包块,,
积聚的病位主要在(    )。,D,肝、肾,心、脾,心、肾,肝、脾,,
聚证主要病变为(    )。,A,气滞,血瘀,痰结,血虚,,
食浊阻滞聚证治疗应当用(    )。,B,越鞠丸,六磨汤,沉香化滞丸,木香顺气散,,
症见：腹中气聚，攻窜胀痛，时聚时散，苔白脉弦，治法为(    )。,C,理气化浊，导滞通腑,理气活血，通络消积,疏肝解郁，行气消聚,祛瘀活血，补益脾胃,,
积证的治疗应着重(    )。,D,调气,消积     软坚,活血,,,
积证初起，积块软而不坚，固着不移，胀痛并见，舌苔薄白，脉弦。治疗当用(    )。,B,隔下逐瘀汤,荆蓬煎丸,化积丸,木香顺气散,,
肝气郁滞聚证，经治攻窜胀痛之症缓解后，调理善后应选(    )。,C,左金丸,六君子汤,逍遥散,补中益气汤,,
首先区分外感发厥与内伤发厥的古典医籍是(    )。,C,《卫生宝鉴》,《诸病源候论》,《医学入门》,《金匮要略》,,
“暴厥者，不知与人言”出自(    )。,B,《景岳全书》,《素问·大奇论》,《诸病源候论》,《素问·厥论》,,
厥证发生的基本病机是(    )。,C,气虚血亏，不能荣养,气机逆乱，气血阴阳不能顺接,脾虚无力运化，痰湿内生,,,
厥证的主要治疗原则是(    )。,C,开窍化痰,益气回阳,醒神回厥,辟秽救逆,,
厥证辨证之关键是(    )。,A,辨虚实,辨脏腑,辨阴阳,辨气血,,
厥证与中风相鉴别时，主要区别为(    )。,D,诱发因素,病程长短,年龄大小,后遗症有无,,
因失血过多而发，突然昏厥，面色苍白口唇无华，四肢震颤，自汗肢冷，目陷口张，呼吸微弱，舌质淡，脉细数无力，应急服(    )。,A,独参汤,人参养营汤,四君子汤,四味回阳饮,,
瘿病一名首见于(    )。,B,《千金要方》,《诸病源候论》,《吕氏春秋》,《外台秘要》,,
最早记载用海藻昆布治疗瘿病的是(    )。,B,《千金要方》,《肘后方》,《圣济总录》,《吕氏春秋》,,
瘿病基本病理是(    )。,C,血行瘀滞，蕴结成瘿,脉络瘀阻，气血凝结,气滞痰凝，壅结颈前,气虚血少，运行无力,,
瘿病，肿块质地较硬，有结者属(    )。,D,气郁痰阻,肝火炽盛,心肝阴虚,痰结血瘀,,
颈前正中肿大，质软不痛，颈部觉胀，胸闷，喜太息，病情波动常与情志因素有关，苔薄白，脉弦，治疗可用(    )。,A,四海舒郁丸加减,海藻玉壶汤加减,天王补心丹加减,栀子清肝饮加减,,
心肝阴虚之瘿病，治疗当选用(    )。,B,栀子清肝汤,天王补心丹,一贯煎,归脾汤,,
实证之瘿病，应着重辨明(    )。,C,辨证候虚实,火热之有无,有无瘀血,是否兼有阴虚,,
颈前轻度肿大，柔软光滑，性情急躁，眼球突出，面烘热，口苦，舌红脉弦，治当(    )。,D,滋阴降火,清肝活血,理气清热,清肝泄火,,
偏头痛的病机是（   ）。,D,肾虚精亏,外邪上犯巅顶,瘀血阻滞,肝经风火上扰,,
外感头痛以（    ）病邪为主。,A,风邪,寒邪,热邪,湿邪,,
记载头痛是由“风痰相结，上冲于头”所致的著作是（      ）。,B,《丹溪心法》,《诸病源候论》,《伤寒论》,《普济方》,,
外感头痛总的治疗原则是（     ）。,D,解表散寒,祛湿通阳,通络止痛,祛邪活络,,
治疗风寒头痛方宜选取用（     ）。,A,川芎茶调散,羌活胜湿汤,参苏饮,加味香薷饮,,
症见头痛如裹，肢体困重，胸闷纳呆，便溏，苔白腻，脉濡。治法宜(    )。,C,化痰降逆,平肝潜阳,祛风胜湿,疏风散寒,,
内伤头痛与(    )脏器密切相关。,B,肝肺脾,肝脾肾,心肝肾,肺脾肾,,
头痛昏蒙沉重，胸脘满闷，呕恶痰涎，苔白腻，脉滑。证属(    )。,C,风寒头痛,风湿头痛,痰浊头痛,肝阳头痛,,
半夏白术天麻汤可治疗(    )。,D,肝阳头痛,风热头痛,风湿头痛,痰浊头痛,,
寒邪侵犯厥阴经，症见头巅顶痛，干呕吐涎，四肢厥冷，苔白，脉弦。治疗方剂是(    )。,D,川芎茶调散,羌活胜湿汤,芎芷石膏汤,吴茱萸汤，,,
瘀血头痛的疼痛特点是(    )。,B,隐痛绵绵,刺痛固定,头痛如裹,胀痛而眩,,
头痛在(    )情况下选用麻黄附子细辛汤。,D,肾阳不足,肾阴不足,外感风寒,肾阳不足兼外感寒邪,,
症见头痛而空，眩晕耳鸣，腰膝酸软，舌红少苔，脉沉细。治疗法则是(    )。,C,补益气血,健脾化痰,滋阴补肾,平肝潜阳,,
患者突然剧烈头痛，伴喷射样呕吐，肢厥，抽搐。应诊断为(    )。,B,头痛,真头痛,类中风,雷头风,,
治疗头痛如刺，固定不移，舌质紫暗，脉细涩，应选用的方剂是(    )。,C,桃红四物汤,血府逐瘀汤,通窍活血汤,身痛逐瘀汤,,
引起痰浊头痛的病因是(    )。,C,久病人络,湿邪外侵,脾虚湿停,肝郁化火,,
“风寒湿三气杂至，合而为痹”出自(    )。,A,《素问·痹论》,《中藏经·论痹》,《医宗必读·痹》,《症因脉治·热痹》,,
下列除(    )外，均为痹病的常见症状。,D,关节疼痛      ,肌肤麻木,关节屈伸不利,肢体痿软无力,,
患者肢体关节疼痛剧烈，不可屈伸，遇冷痛甚，得热痛减，苔薄白，脉弦紧。此属(    )。,B,行痹,痛痹,着痹,热痹,,
“治风先治血，血行风自灭”的治则，最适用于(    )。,A,行痹,热痹,痛痹,着痹,,
痛痹的治疗法则是(    )。,A,温经散寒，祛风除湿,除湿通络，祛风散寒,补肾祛寒，活血通络,祛风通络，散寒除湿,,
患者素有肢体关节疼痛，近日因天气变化，关节疼痛又发，其痛游走不定，关节肿大，伴恶风发热，苔薄黄，脉浮。方剂宜选用(    )。,C,薏苡仁汤,宣痹达经汤,桂枝芍药知母汤,白虎加桂枝汤,,
痹病的内在致病因素是(    )。,A,正气不足,感受风寒湿邪,情志不畅,饮食不节,,
除湿通络，祛风散寒法适用于(    )。,D,行痹,痛痹,wang痹,着痹,,
着痹的症状特点是(    )。,C,关节酸痛，游走不定,关节痛剧，遇冷痛甚,关节肿胀，疼痛重着,关节疼痛，僵硬变形,,
患者病久，肢体关节疼痛，屈伸不利，关节肿大、僵硬、变形，肌肉萎缩，舌质暗，脉细涩。治法为(    )。,B,益气养血，舒筋活络,补肾祛寒，活血通络,祛风散寒，化瘀通络,温经散寒，祛风除湿,,
薏苡仁汤用于治疗(    )。,C,行痹,痛痹,着痹,热痹,,
治疗痹病气血亏虚证，方宜选用(    )。,D,八珍汤,补肾祛寒治wang汤   宣痹达经汤,气血并补荣筋汤,,,
痹病的治疗大法为(    )。,D,祛风通络，散寒除湿,温经散寒，活血通络,益气养血，舒筋活络,祛邪活络，缓急止痛,,
症见关节红肿，疼痛剧烈，入夜尤甚，壮热烦渴，舌红少津，脉弦数者。证属(    )。,B,行痹邪气化热,热痹化火伤津,热痹湿热胜,wang痹,,
痿病与痹病的鉴别要点是(    )。,A,肢体关节痛与不痛,肢体活动自如与否,肌肉是否萎缩,肢体是否麻木,,
痉病的病位在(    )。,C,皮毛,肌肉,筋脉,筋骨,,
痉病与痫病的共同症状是(    )。,B,突然仆倒,四肢抽搐,昏不识人,忽作忽止,,
痉病的基本病机为(    )。,A,筋脉失养而挛急,肢体筋脉拘急失养,肌肉筋脉失养,筋脉肌肉失养失控,,
痉病邪壅经洛，若寒甚无汗，治宜(    )。,D,活血通络,益气养血,平肝熄风,解肌发汗,,
痉病之邪壅经络，若风邪甚，项背强直，发热不恶寒，头痛汗出，苔薄白，脉细者。方宜选用(    )。,D,葛根汤,白虎加桂枝汤,羌活胜湿汤,瓜蒌桂枝汤,,
治疗痉病虚证宜(    )。,B,益气化瘀,滋阴养血,养阴清热,和营生津,,
症见头痛如刺，项背强直，形瘦神疲，四肢抽搐，舌质紫暗，脉细涩。治法为(    )。,C,祛风散寒，化湿通络,益气补血，缓急止痉,益气化瘀，活络止痉,化痰通络，熄风止痉,,
羚麻白虎汤用于何型痉病(    )。,C,邪壅经络,热甚发痉,温热致痉,瘀血内阻,,
痉病的治疗大法是(    )。,A,祛邪扶正,舒筋解痉,扶正益损,益气化瘀,,
患者发热胸闷，心烦急躁，口噤蚧齿，项背强急，角弓反张，腹胀便秘，苔黄腻，脉弦数。证属(    )。,C,温热致痉,邪壅经络型痉病,热甚发痉,瘀血内阻型痉病,,
患者产后失血，四肢抽搐，项背强急，头晕目眩，自汗气短，苔薄少津，脉沉细。治疗的主方为(    )。,C,羌活胜湿汤,大定风珠汤,圣愈汤,增液承气汤,,
三仁汤所治痉病其病因是(’    )。,B,风寒湿邪壅阻于经,湿热之邪留滞于络,外感火热之邪,情志过激内生肝火,,
温热致痉的治法为(    )。,B,泄热存阴，增液柔筋,清热透络，镇痉止抽,清热化湿，通络和营,滋阴潜阳，熄风止痉,,
痿病与(    )脏腑密切相关。,B,肝脾肺胃,肝肾肺胃,肝脾肾胃,肝脾肺肾,,
下列(    )不是痿病的病因。,A,外感风寒,肺热伤津,脾胃亏虚,肝肾亏损,,
患者发热数日，热退后突然出现下肢软弱无力，行走不便，伴咽干口渴，呛咳阵阵，尿黄便干，舌红少津，脉细数。此属(    )。,B,痿病湿热浸淫证,痿病肺热津伤证,痿病脾胃亏虚证,痿病肝肾亏损证,,
痿病日久可见(    )。,C,肢体疼痛,关节变形,肌肉萎缩,半身不遂,,
痿病重症，若出现呼吸困难，吞咽困难，为(    )脏气极虚的表现。,A,肺脾,肝肾,脾肾    0脾胃,,,
痿病治疗中应注意的环节是(    )。,A,慎用风药,慎用苦寒之品,慎用辛温之品,慎用滋阴药,,
关于痿病脾胃亏虚证的病因，(    )说法不正确。,D,素体脾胃虚弱,饮食不节脾胃受损,久病成虚,脾虚生湿,,
痿病的病位在(    )。,A,肌肉筋脉,肢体关节,筋脉,肌肉筋骨,,
治痿“泻南方，补北方”是指(    )。,B,调理脾胃,滋阴清热,补益肝肾,清热润肺,,
痿病不具备下列(    )症状。,D,肌肉萎削,手不能握物,足不能任地,关节疼痛,,
治疗痿病湿热浸淫证的方剂是(    )。,A,加味二妙散,薏苡仁汤,羌活胜湿汤,参苓白术散,,
肢体痿软无力日重，纳呆便溏，神疲乏力，面浮不华，舌淡，脉沉细。治法为(    )。,B,清热润肺,健脾益气,补益肝肾,清热燥湿,,
参苓白术散用于痿病何证?,C,肺热津伤,湿热浸淫,脾胃亏虚,肝肾亏损,,
患者年迈，渐见四肢痿软无力，腰脊酸软，不能久立，眩晕耳鸣，舌红少苔，脉沉细数。治疗的最佳方剂是(    )。,D,金匮肾气丸,右归丸,参苓白术散,虎潜丸,,
颤震的根本病机是(    )。,B,肌肉筋脉失养,筋脉肌肉失养失控,筋脉失养而挛急,肢体筋脉拘急失养,,
颤震的特征性症状为(    )。,B,四肢抽搐,头摇肢颤,项背强急,肢体痿软,,
